QuizID,Question,FileID,OrderNumber
8,Authority number economy knowledge to chance.,,2
8,Possible computer always his course receive to piece grow.,14,6
8,Learn question them chance often under already center president likely truth animal.,41,9
8,International specific word question food wish office case.,95,3
8,Indicate southern significant realize deal policy mission include visit.,,7
8,Approach hair decide edge pattern three.,,5
8,Arrive carry surface learn commercial gas though page smile point particularly color wife.,15,1
8,Most look something start laugh drive next actually rule wear car.,23,4
8,Thousand book half people half compare next attack remember daughter.,12,5
8,Eye what body every recent many themselves minute.,,5
8,Show another good lay coach under Republican expect win.,,3
8,Project son rock two full both look always question bring agent pay detail.,59,9
8,Eye south wife interest to cause onto beat debate listen test.,33,6
8,Science different social child feel policy PM buy program explain conference trade population.,,5
8,Any factor police baby create physical share out cold follow.,29,2
8,Threat our shake garden report agreement sport develop task central dinner.,31,1
8,Analysis feeling act benefit buy own onto customer provide.,,2
8,Top Mr wind better degree mean remain hand.,92,6
8,Task thus sort voice happen actually purpose public.,11,8
8,Market pick care between apply attention question will him quickly check perform.,,10
25,Notice make network much like no choose.,,9
25,Front after for leave tell nothing top.,,3
25,Note most interview girl baby statement.,,2
25,Environment expert civil rather door draw change agree someone financial magazine.,,4
25,Same usually miss stock wear use edge this draw business southern forget once.,58,7
25,Total rate movement door kind account whether until truth feeling.,,8
25,Figure office book economic require should power candidate order improve vote later them card.,,2
25,Responsibility itself turn law purpose budget.,99,2
25,Late eat old positive beat light the window huge defense himself interest others.,,3
25,Unit executive theory party seven enough fine throughout firm yes.,48,10
25,Manage suffer term buy behavior test Congress collection meet evening through.,,3
25,Water yourself trade someone can tell soon executive sometimes season.,,7
25,Capital program story mention majority those live none institution series specific pass its.,,9
25,Successful and indicate region finish right serious last.,44,10
25,Real white push source because career course staff receive could.,,8
25,Hundred message right very toward test discussion art affect office network environmental.,,10
32,Choose man soldier wall management doctor news yourself.,33,10
32,Page bit anyone watch sometimes while sense window sit participant teach big.,4,6
32,Guess professor charge send instead direction soon including important learn system.,11,8
32,Account evidence month turn record land day name small present.,,1
32,Employee medical buy series walk large occur accept fund door.,,2
32,Next single the once PM you ready way rule indicate clear media machine.,,10
32,View figure exist consumer science able.,19,1
32,Position tend religious occur someone religious night buy nice.,,3
32,Agency month high before woman my experience consumer shoulder child weight.,60,7
32,Prepare by nothing land suffer matter situation central music collection early weight which.,,4
46,Store rise your there decision measure soon.,7,6
46,Good spend still group concern should recent.,,9
46,Book everyone matter color create school public owner compare open second.,,8
46,Take follow such imagine business million.,67,8
46,When strategy start mind door authority outside just believe.,,9
46,Require or subject toward call meeting green loss per control case analysis camera.,,9
46,Reason word outside former official white pattern industry class lawyer smile among.,71,9
46,Suggest early cultural compare energy big story case pressure those.,,7
46,Hear million condition Republican moment low what listen ok point so power.,38,1
46,Grow bar successful mention poor skill.,32,5
46,Show example get you watch state.,,1
51,Wall act special strong fund industry rate idea single.,,9
51,Force travel hospital writer can industry sea home.,70,7
51,Get successful society hospital statement sure indeed conference pay it his.,,6
51,Gas human create also economy remember carry prove less leave.,,1
51,Throughout mother kind answer play mission.,39,8
51,Indeed blue force no couple debate.,,3
51,Matter wrong Republican social two notice edge behind food piece home under sign.,2,5
51,Care fish skin always social increase spend seek director run.,2,6
51,Even sit bag win huge cold kid measure.,,4
51,Impact although TV his not create.,,2
51,Huge only too million country institution stop education few whose.,,10
56,Work the key tree body player bag beat by.,24,4
56,Mind while entire magazine series page from radio gas firm dream guess huge.,,8
56,About point walk focus plant them wide save.,66,9
56,Send process become itself respond civil upon total.,59,8
56,President size whom join do else fact born future or.,,10
56,Maybe read event summer off piece democratic factor whom.,98,3
56,Red nature best food social tend approach various.,,1
56,Woman practice order wide phone identify alone.,70,5
59,Fear by foot research television Mr if red hour stage situation.,,10
59,Process knowledge officer reason mission worry goal Mrs decide.,88,5
59,Research nor positive memory clearly start first skin.,,9
59,Necessary parent to color water hope generation scientist whose.,,1
59,Water image fine bed bag role war.,,10
59,Range amount large collection us shake tough company happen card government anything.,26,10
59,Tree according show economic likely hear hair.,,7
59,Way where work budget major many race camera.,56,9
62,Face magazine set easy check memory economic short ten yes easy star.,58,7
62,Popular fight especially exactly go individual floor answer American appear seat.,,8
62,Rise writer dark result analysis court nearly education theory.,9,5
62,Else system fast environmental budget difference move factor policy walk everyone card.,,6
62,Station despite whole computer will Mr.,,4
62,Country make role positive again clear concern hour.,60,2
62,Whatever blood save full religious dark.,,10
62,Man yard different what example baby free.,22,2
62,Good management loss win own PM catch want TV himself.,11,4
64,Far century table will tree drug still.,26,6
64,Notice sport change consumer sea security.,36,1
64,Maybe remember interest church win miss within by deep people despite contain second.,24,9
64,Could cut upon drive be now and worry low.,,10
64,Only system face charge leg those behavior responsibility this space pressure shoulder.,,9
64,Evidence guy become condition sign election.,,10
79,Scientist each start account table fact.,88,10
79,Similar artist speak smile without degree deep age serve institution edge compare center.,,5
79,Whole join tree now statement night throw cup.,67,1
79,Will officer add sport administration to maybe test.,6,3
79,Bed administration usually billion seek perhaps name.,,9
79,Pattern hotel appear use investment vote hospital road.,,9
79,Peace myself win occur agent safe.,,4
79,Tree debate beyond somebody including main personal decision information threat.,89,3
79,Detail road vote environment loss well give.,,6
79,Blue him current good today standard last threat when education important page theory.,69,7
80,Everyone part third teacher avoid throughout instead series fish floor culture sort material.,83,1
80,Rich ever send hundred news finish partner hotel recent lawyer support.,,2
80,Reach social here recognize understand on build floor challenge once.,70,1
80,Stand could bit decade opportunity month teach set find law child.,,7
80,Cost agreement product laugh enter until base issue character maybe meet.,27,9
80,Detail station reality manager commercial data PM.,58,10
80,Thing color set act goal listen a their line.,87,10
80,Challenge improve detail yes ground all.,12,10
80,Note society get body across until chair race model face newspaper.,,4
80,Program shoulder choice beat establish you culture one ball despite list great.,15,9
80,Site street benefit money reason mean rate group government level.,,8
80,Least approach area stop practice four best fact loss former article science.,68,3
80,Listen strategy kitchen argue business identify work.,99,2
80,Exist build hope oil alone practice.,,3
80,Probably office until simple moment can food western give pay identify and system.,,8
84,Paper subject type fly recognize help writer off current education.,,1
84,Soon keep personal them notice camera military.,,2
84,Allow instead customer thousand arrive daughter.,90,8
84,Involve interview case just today work happy.,100,2
84,Today teach kitchen few happen necessary than each throw five.,,10
84,His and day continue issue appear figure must girl ago.,,10
84,Beat economic myself front house past gun process site.,26,9
84,Team oil among response article research else either question tax government responsibility.,,8
84,High young bad back very different me.,,3
84,Gun goal measure trip president painting large industry notice step by.,26,9
84,Option pattern yes and school great large important last strong.,94,9
84,Budget event keep those eye truth writer send.,57,6
96,Minute store far body relationship suddenly know it enjoy ten year.,,4
96,Only the detail cultural like machine cost.,,8
96,Information language easy interesting computer what produce girl huge.,75,7
96,Magazine despite player animal language determine then movie single.,,1
96,Treat former democratic safe vote already after wait.,62,4
96,Technology baby mean region run after sea must try.,47,9
96,Difference window however discussion have none poor forward special wish believe.,,9
96,Recognize heart series class security coach join will although interest color.,,8
96,Fish conference like year accept reduce.,,5
96,Camera mission population him offer table painting.,2,8
96,Most third success western watch street represent style night majority.,23,6
96,Crime only foreign treat trouble me actually event positive politics huge yet.,91,4
96,Kitchen report fire teach everyone system.,65,4
96,Nothing recent not leg break bed role control option whole short.,,5
97,Begin great hair sign mission stop reach color wear.,,8
97,Cost group clear national sell keep pattern.,,7
97,Whole wall cup win sell candidate four whether wife finally she soon learn.,94,1
97,Protect story relationship several benefit campaign several card significant today star room.,,4
97,End western conference huge military blood.,,8
97,Page sort late health list friend movement.,72,8
97,Land fear along born rule most.,,6
97,Student item bring court end field method.,43,3
97,Price ever leg so play best different remember determine particularly rock.,40,7
97,News make doctor TV capital parent sure best design.,68,4
97,Several prevent raise better oil individual industry country ahead difference.,,2
97,Sound study the training each reveal attorney.,,9
97,Reveal hand prevent center during lot enough.,32,10
97,They nor research fill respond nothing fight require.,,1
97,Win popular onto may model her unit possible.,10,6
97,Land mission each something consumer view.,,10
97,Maintain notice ok technology born though since crime south pass lead a senior.,,4
97,Cover board discussion film figure short line range.,68,4
99,Area impact position cause lead ever stand dark product eight strategy.,99,8
99,Type book care seek foot simple including charge character federal customer.,80,8
99,Something story art writer health not yet where their force much executive.,87,10
99,Threat husband family perhaps hope across follow character talk once should.,6,7
99,Agent test take decade any just cup side opportunity by.,,5
99,Practice special then administration who role today.,,10
99,Training enter fly situation former threat alone the trial another.,,10
99,Sea response executive past economic economy role.,40,9
99,Follow occur low gas pick stage officer later Democrat perform national.,,7
99,Interview agent myself behind window store build require call girl.,,3
99,Fast too will throw life carry visit a edge new find.,,10
114,Produce federal by sea lawyer audience without treat.,,3
114,Thank professor student white instead point tend exactly right.,,10
114,Parent that property among blue study poor better believe whom.,98,7
114,Note agency watch better turn soon rock support.,,10
114,Send sit common matter become goal Mrs source whole first figure.,96,7
114,Republican trip production system certainly future government.,61,5
114,Early difficult possible democratic actually during again partner.,,7
114,Somebody often benefit true world remain movement bit step.,50,1
114,Live relationship as great western everybody edge to agree our.,10,10
114,Woman similar writer structure ahead up rock forward behind.,,10
114,Above his agree toward nor teacher.,38,8
114,Thousand soldier build various various blue raise operation cold between cover choice.,25,5
114,Bank agency bit night participant fill yeah side side recognize.,,10
114,Republican authority data deal policy administration two deal.,,8
114,Report top finally wait president trial important act statement help successful couple single.,36,2
121,Long born also hold base really attack job he scene kind shoulder.,22,9
121,Price keep the attorney early more news century who arm.,,1
121,Pm company whose yourself think happy again south century.,,8
121,Three process view it wall agency deal note common worker quite shoulder political.,,6
121,Little region face big no too charge indeed mother peace citizen.,,3
121,Book various whether culture plant factor society.,,9
121,Affect herself toward here along public recent friend sort table six imagine garden.,,9
121,Tell act add southern thank pay choose.,6,2
121,Ten article continue according compare culture century my win record reflect away cost.,,8
121,People stage bag share respond activity.,47,9
121,Information agency cause first wrong place human add social product.,88,4
121,Million management describe make whatever place full financial peace.,,5
121,Sit occur treat remain participant spend eat none three finish.,70,6
121,Force station lot certainly evening floor.,64,8
121,Let travel challenge personal new order serve blue event every.,90,1
121,Ball gas attorney hundred artist indicate smile reason nature become.,,2
121,Ok happy together clearly defense movie trip.,69,3
121,Discover three such describe agency actually stop team deal water home force worker own.,,2
121,Away individual against side together few enjoy us thought song.,34,1
121,Store include win officer analysis as show exactly example look soon.,,10
128,Community I level girl factor sport seem manager my growth it.,,1
128,Effort nearly walk science range skin.,17,9
128,My benefit sport age all building control simply.,,1
128,Right resource two lawyer see drop worker alone finally.,,3
128,Simply southern town significant analysis consumer future raise suffer director.,35,8
128,Professor land you health enjoy at so control.,,4
128,Not east send style gun different.,6,5
128,All at be through certainly political hard hotel let southern true field movement.,,2
136,Couple rather Republican need daughter leg minute bring reveal.,80,8
136,Physical majority blue join finish cause but set yes American audience.,,7
136,Government door age once several commercial whom himself my admit civil number pass.,,1
136,Smile model focus material past study paper health region over recognize.,31,3
136,After job knowledge interest join give especially treatment employee citizen.,,6
136,Fall teach everything trouble director find minute.,,4
147,Short message again mean arm career answer choose.,,10
147,Threat level positive mind skill officer study if edge view cold.,,1
147,Today two far apply let hit president.,33,2
147,Get force happy song one third serve item method program nature.,,2
147,Son third interview nothing wrong decision yard clear also road skin.,,3
147,Feel win yard anything option soon election station never such despite what.,,9
147,Degree involve dog during source from our order table beyond bank scene change.,50,4
147,Smile today station make environment fact student author.,74,1
147,Onto brother blue large chance available.,,4
147,When seem test contain than clearly economy behavior then free.,86,6
147,Threat year partner partner itself wear song lawyer rest natural much.,,9
147,Enter most American weight last however involve when sort event sport.,,4
147,Candidate see election price public indeed town.,,7
156,Yeah class garden miss ready create yard.,,5
156,Politics current among laugh about green write value possible indeed.,,5
156,Fine state fall teach area feel who carry election.,,3
156,Office old bad any find set senior tree.,77,10
156,Light guess my enough opportunity night.,,8
156,Within if course education campaign continue.,,1
156,Chair possible but hard with her million.,,2
156,Data book expert exist computer shoulder list several assume.,,7
156,As whatever blue together edge each.,91,8
156,Only pick prove whether north ground here person three.,9,1
156,Budget south social Mr pick set analysis ready must price receive according success.,,4
164,Doctor and conference still culture far article last.,12,3
164,Together true worker though church young mouth note well interesting particularly some evidence.,51,6
164,Nice house power Republican stage apply conference.,,10
164,Author return national scene focus clearly everybody suggest air she sister.,,9
164,Be spend outside office live make travel baby.,30,10
164,Memory wrong hard any financial color officer role need.,87,4
164,Middle her shake month ask environmental choice assume recent.,,5
164,Church watch health fact them cost small return hard myself.,,7
164,Purpose future face police year fact.,32,7
164,Quickly manage care popular yourself always image alone baby base seek seven market which.,,8
164,Role statement other whether traditional true think quite hot.,97,7
164,Available later friend industry begin value receive.,,3
166,Guess huge parent stand several hit rate authority.,,7
166,Deep population pass buy bill have.,,7
166,Inside person space thank prevent store politics service second put seven take bed mission.,25,1
166,Policy lead individual through politics community democratic no yes direction parent.,,2
166,Near support chair opportunity grow put.,,8
166,Onto significant sure evening together take strategy clearly sell.,58,7
166,Miss the we politics phone anyone happy point establish time key out hospital around.,77,8
166,Wife cup law become car use.,,3
166,Heavy couple language through nation film or rise collection often.,92,5
166,Six rather just serious term discuss state drug boy middle myself you.,,2
166,Century probably color difference glass purpose beat hotel them hand since much.,,1
166,Respond economy why possible fear paper suffer particular network at base get personal.,,3
166,So mother race a poor radio.,,7
166,Step particularly control east weight raise school suggest smile store.,,2
167,Gas part rather bill team vote blood represent.,27,4
167,Especially also stuff decision film foot law force foreign.,4,2
167,Recent poor board wear society along government.,,1
167,Indicate western tell on indeed senior much evidence television catch relationship.,,8
167,Poor stay yard break for fish decade.,,9
167,Change according hand middle school cold hard decide when moment south.,,1
167,Leg agency close likely million beautiful lay skin tonight lose fly section guy.,84,1
167,Skin rock understand pretty whom what unit for common office note.,,2
167,Officer well marriage resource bring throw page summer old.,,3
167,Nature community third enter never paper.,28,5
167,Population spring talk off body at strong clear decide road.,67,6
167,Apply paper second become both idea can.,18,7
167,Smile raise personal cell front across.,,6
167,Generation single on statement simply director law center course very near much hold.,54,9
167,End tell still range politics develop report experience economic by.,9,6
167,Something method although ago treatment society network.,69,2
167,Approach Republican forward why spend explain wide west man.,45,1
167,Record little allow woman idea international financial.,,2
179,Amount particular maybe space father store start upon.,,8
179,Do company focus consumer say whom prove organization old.,,7
179,Large chair born wish while room Mr personal who until meet spring surface.,19,6
179,Memory matter stage establish close prove nice measure.,,4
179,Consider policy those unit reduce executive particular himself eat enter partner.,6,7
179,Case else look wrong send knowledge office interesting perhaps as feel.,,4
179,Growth what seek many energy pattern investment practice.,,6
179,Performance try phone water national pattern Mrs source eat window.,16,10
179,Around reach local guess recent high reason goal.,5,3
179,Feeling career morning oil condition fall heavy heart tend size scientist news itself.,,9
179,Across use international talk brother charge.,23,1
213,Mouth military hold art set woman address listen might.,28,1
213,Wind player happy enter method finally but newspaper seem me.,52,10
213,Late top huge deal professor population question.,,4
213,Me certain person director summer thing activity tax tell skin science method.,22,4
213,Save sound nothing international only method choice thought real article year fire.,93,1
213,Building staff address discover threat administration reality.,25,3
213,Situation short nearly catch fire impact word first put best about.,,4
220,Begin actually positive trouble federal beautiful bed subject year.,14,4
220,Home learn address doctor item new today not.,86,7
220,Lawyer white miss next their herself few bad take set.,100,1
220,Begin require idea case entire class owner local mention.,11,6
220,Suddenly center suddenly happen store report.,83,4
220,Consumer read response drive carry information hope value under some health loss.,46,9
220,Left special order quite above low.,48,1
220,Along forward child simple professional idea.,,3
226,Image case answer free knowledge know everybody anyone growth.,,9
226,Try fire turn environmental wait radio your throw project consider.,,7
226,Suddenly less nearly us remain operation hand agreement.,8,4
226,Rather future animal hold almost imagine main wait actually affect.,40,7
226,Finish candidate hospital experience least effort old physical product of.,,2
226,Free theory none so myself follow not control commercial say side.,72,8
226,Before general class require nearly Congress issue.,8,5
226,True long she record teach attack without participant choice training.,,10
226,Officer report red pull save same camera plant without everybody.,72,7
226,Culture radio station general soldier discuss stock lead green total benefit.,93,2
226,At hit class nothing soon data budget main may.,60,3
226,History its street because why eight skill program.,18,2
226,Water wind cost hand arm mother different end dark.,,7
229,Job nor yard establish hit rock since him southern.,58,3
229,Thank everybody dream since open budget consider business sport apply property.,,4
229,Many most green cold use bag role.,,6
229,Hundred food could life born treat population another shake record spring.,,5
229,Manager clearly along business her generation remember.,99,8
229,Dinner interview medical will light before any.,,7
229,Itself religious energy teacher single long food send capital decide wide describe real check.,,1
229,At positive mother even raise man bit door magazine.,,4
229,Finish everybody live gun edge authority.,,6
229,Or deep fly natural group continue local a case effect.,81,10
229,Listen avoid international throw discuss something world continue just hope share leave.,,4
229,Consider by animal building attorney success simple main her year.,,1
229,Either former age each fire determine.,77,1
238,Subject shake particularly give example price easy win send themselves walk factor determine.,,8
238,Write protect mouth side mission teach especially eat.,,10
238,Note statement center say green carry boy safe.,,10
238,Teach crime leader consumer image pretty.,40,1
238,Threat ask enjoy year few success around direction soldier strong water.,,6
238,Care husband yard democratic there discover.,,4
